<!DOCTYPE employeeDirectory [
    <!ELEMENT employeeDirectory (employee+)>
    <!ELEMENT employee (name, department, role)>
    <!ELEMENT name (#PCDATA)>
    <!ELEMENT department (#PCDATA)>
    <!ELEMENT role (#PCDATA)>
    <!ATTLIST employee id ID #REQUIRED>
]>
<employeeDirectory>
    <employee id="E001">
        <name>John Doe</name>
        <department>Engineering</department>
        <role>Software Engineer</role>
    </employee>
    <employee id="E002">
        <name>Jane Smith</name>
        <department>Marketing</department>
        <role>Marketing Manager</role>
    </employee>
    <employee id="E003">
        <name>Emma Brown</name>
        <department>Human Resources</department>
        <role>HR Specialist</role>
    </employee>
</employeeDirectory>
